<?xml version="1.0" encoding="UTF-8"?>
<tns:cinema xmlns:tns="http://www.example.org/cinema" xmlns:xsi="http://www.w3.org/2001/XMLSchema-instance" xsi:schemaLocation="http://www.example.org/cinema cinema.xsd ">
  <tns:Film >
    <tns:titre>Les bronzes</tns:titre>
    <tns:année>1978</tns:année>
    <tns:réalisateur>Patrice Leconte</tns:réalisateur>
  </tns:Film>
  <tns:producteur>
    <tns:nom>Daniel Toscan du Plantier</tns:nom>
    <tns:Film >
      <tns:titre>tLes bronzes</tns:titre>
      <tns:année>1978</tns:année>
      <tns:réalisateur> Patrice Leconte</tns:réalisateur>
    </tns:Film>
    
  </tns:producteur>
</tns:cinema>
